{
  "artifact_sha256": "3333333333333333333333333333333333333333333333333333333333333333",
  "build_commit": "0000000000000000000000000000000000000000",
  "config_bundle_sha256": "2222222222222222222222222222222222222222222222222222222222222222",
  "contract_manifest_sha256": "1111111111111111111111111111111111111111111111111111111111111111",
  "emitted_at_us": 1786156800123456,
  "event_id": "evt_triad_binding_v2",
  "event_kind": "BINDING_RECORD",
  "payload": {
    "activation_scope": "E01;G1;venue/instrument/metadata-revision exact scope",
    "binding_digest": "3a910dfc95cd0134ea415f8a6edb925239ec8fb651c8df1d8f51f7e61aabaa13",
    "binding_id": "FPB-0001",
    "boundary_rule": "nonzero remainder quarantines",
    "cardinality": "EXACTLY_ONE",
    "condition": "accepted venue price parse under exact metadata revision",
    "consumer": "E01",
    "consuming_wiring_ids": "W01",
    "declared_value": "price_ticks=exact_div(venue_price,tick_size)",
    "disposition_reason": "",
    "failure_behavior": "QUARANTINE_INGRESS_EVENT",
    "formula_id": "F00",
    "gate": "G1",
    "lifecycle_status": "ACTIVE",
    "migration_state": "NOT_APPLICABLE",
    "operation_id": "RC3-BOP-010",
    "parameter_id": "PAR-001",
    "parameter_name": "PRICE_WIRE_TYPE",
    "precedence": "AT_INGRESS_BEFORE_CANONICAL_EVENT_PUBLICATION",
    "semantic_slot": "ingress_price_wire_integer_ticks",
    "source_binding_id": "FPB-0001",
    "status": "ACTIVE",
    "superseded_by": "",
    "unit": "tick",
    "unit_contract": "exact decimal venue price / exact tick_size -> signed int64 ticks"
  },
  "producer_instance_id": "inst_golden_01",
  "producer_service": "contract-governance",
  "schema": "triad.binding.v2",
  "schema_version": "2.0.0"
}
